festival_name,genre,city,state,start_date,end_date,description
Ziro Festival of Music,Music,Ziro Valley,Arunachal Pradesh,26 Sep 2024,29 Sep 2024,"Held amidst the spectacular Ziro Valley in September, this four-day annual festival is hosted by the local Apatani tribe, known for their closeness to nature. With an infrastructure built almost entirely of locally-sourced bamboo and a strong emphasis on eco-friendly practices, Ziro Festival of Music is a one-of-its-kind event. The carefully-curated line-up brings together over 40 of the best independent music acts from across the region, country and world."
Zindagi Mubarak,Multiarts,Dehradun,Uttarakhand,15 Aug 2024,17 Aug 2024,"Zindagi Mubarak is a three day zero waste festival held in the picturesque mountains of Uttarakhand, curated by Ishqestan and Kaarkhana. It has been started with a noble intent to create a platform for the local artists and the artisans; employment opportunities for the villagers and to celebrate this very gift that is life. Immersive musical concerts, workshops, barefoot nature walks, sharing sessions, yoga and meditation, open mic sessions, bathing in the fresh waters, experience of living in the mountains, magical sunrises, moonrises, sunsets and winding pathways, are some of the highlights of this holistic festival."
World Jazz Festival,Music,Delhi Mumbai Bengaluru Pune,Andhra Pradesh,04 Apr 2025,13 Apr 2025,"Events companyBanyan Treelaunched the World Jazz Festival in February 2020 with the intent to showcase and celebrate jazz and world music in India. The festival, held in association with the Amersfoort Jazz Festival in the Netherlands, features artists from around the globe."
Wahyum Festival of Arts and Music,Music,Imphal,Manipur,16 Dec 2022,18 Dec 2022,"Launched in 2021, the annual three-day Wahyum Festival of Arts and Music is named after its venue, the Wahyum Eco Resort. The spot was specifically chosen for its location, the scenic village of Taorem, which is away from Imphals din and bustle yet close enough to the city to make travel convenient for attendees."
W.I.P alt.FEST,Multiarts,Delhi,Delhi NCR,01 Dec 2024,15 Dec 2024,"The W.I.P Alt Festival is a groundbreaking international arts festival dedicated to showcasing alternative, and experimental works across all disciplines – music, film, performance, visual arts, movement explorations and more."
Vivaan – Handpan & World Music Festival,Music,Goa,Goa,14 Feb 2025,16 Feb 2025,"Vivaan is a unique gathering where music, art, and nature converge to create an immersive and soulful experience. Since its inception in 2017,the festival has celebrated the universal language of sound, highlighting its ability to heal, uplift, and foster deep connections."
Vh1 Supersonic,Music,Pune,Maharashtra,16 Feb 2024,18 Feb 2024,"Vh1 Supersonic goes far beyond being a celebration of music. The expanse of its grounds accommodates five grand stages, complemented by an impressive array of over 75+ stalls, 30+ delectable food vendors, 60+ distinguished liquor brands, 80+ fashionable boutiques, and an array of other captivating attractions. These offerings converge to curate an enthralling and immersive experience for an extensive gathering of over 70,000 attendees."
The Sound of Energy by Amarrass Nights,Music,New Delhi,Delhi NCR,16 Mar 2024,,"Since its inception in 2009, Amarrass Records and Amarrass Society for Performing Arts have been striving to create sustainable ecosystems that preserve, promote and nurture folk and traditional forms of music and arts. As part of this initiative, Amarrass Nights has become an integral platform to showcase young artists, as well as living legends, held at iconic locations across Delhi."
The Soul Local,Music,Kolkata,West Bengal,21 Dec 2024,22 Dec 2024,"The Soul Local is a multi-genre music and art festival that has become a hallmark of Kolkatas event calendar. Launched in 2016 byCalcutta Cacophony,the event began as a modest passion project on a terrace, celebrating the citys unique cultural fabric. Over the years, it has grown into a two-day spectacle, with an eclectic mix of music, art, and immersive experiences. As of 2024, The Soul Local has completed four editions, each growing in scale and impact. The festival has transitioned from its humble beginnings to hosting large-scale events at prominent venues, most recently drawing over 20,000 attendees at Gitanjali Stadium. The fifth edition, scheduled for December 21st and 22nd, 2024, at Aquatica grounds, promises to be the most ambitious yet, marking a significant milestone as it coincides with the 10th anniversary of Calcutta Cacophony."
The Sacred Pushkar,Music,Pushkar,Rajasthan,12 Oct 2018,14 Oct 2018,"The Sacred Pushkar, which bears the tagline A Festival of Mind, Body and Soul puts a focus on mindful living with a promise to centre your inner with the outer world. The annual two-day event includes music concerts, meditation and yoga sessions, and food and heritage walks that celebrate its location in the historic town of Pushkar. Indian classical, folk and Sufi musicians such as Bhawani Shankar, Bombay Jayashri, Kavita Seth, Mukhtiyar Ali, Vikku Vinayakram have performed at previous editions of the festivals. The third and most recent instalment of The Sacred Pushkar took place in 2018."
The Outback Festival,Music,Leh,Ladakh,14 Sep 2024,15 Sep 2024,"Leh, Ladakh was abuzz with excitement in September 2023 as adventure enthusiasts from across the country gathered for the 2nd edition of the extraordinary Outback Festival. This one-of-a-kind event embodied the essence of Adventure, Music, the Outdoors, and Community, creating an unparalleled experience at a breathtaking elevation of 11,500 feet above sea level. The festival proudly claims to be the worlds highest motorable adventure and music festival."
The Kavi Collective,Folk Arts,New Delhi,Delhi NCR,23 Dec 2023,,"The Kavi Collective presents an exquisite celebration of Indias poetic legacy. Brace yourself, Delhi, for an enchanting evening curated by Red FM to conclude 2023. Dr. Kumar Vishwas, a renowned Hindi poet, politician, and speaker, alongside talented artists Manu, Vaishali, Chandan Rai, Ramesh, Muskan, and Kushal Kushwaha, will showcase their talent at this years Kavi Collective."
The Great Indian Beatbox Festival,Music,Mumbai,Maharashtra,17 Dec 2022,18 Dec 2022,"Organised byBBXINDIA, The Great Indian Beatbox Festival aims to grow beatboxing culture in India, combine all the components of hip-hop and other art forms, and produce an extraordinary experience."
Terrain Riders Festival,Multiarts,Thane,Maharashtra,29 Oct 2023,,
TCS Ruhaniyat,Music,Bengaluru,Karnataka,24 Jan 2025,,"TCS Ruhaniyat is a music festival organised byBanyan Tree Eventsthat features the works of Sufi saints and mystics from around the world. Carriers of living spiritual and cultural traditions including fakirs, Bauls, Kabirpanthis, qawwals, shabad singers, Warkaris, zikir-jari singers and folk exponents from across India perform at thefestival, which has also featured artists from Belgium, Bulgaria, Egypt, Iran, Mongolia, Norway, Senegal, Siberia, Sudan and Turkey since its launch in 2001. The festival is held in collaboration with Tollygunge Club in Kolkata, Empress Gardens, Telengana Tourism and the Chhatrapati Shivaji Maharaj Vastu Sangrahalaya (CSMVS)."
Symphony Orchestra of India Seasons,Music,Mumbai,Maharashtra,02 Feb 2024,16 Feb 2024,"The Symphony Orchestra of India (SOI), based at the National Centre for the Performing Arts (NCPA), Mumbai, is Indias first and only professional orchestra. It was founded in 2006 by NCPA Chairman Khushroo N. Suntook and internationally-renowned violin virtuoso Marat Bisengaliev, who serves as the Orchestras Music Director."
Swag Fest,Music,Delhi,Delhi NCR,11 Mar 2023,,"Organised by Indias leading private radio and entertainment network93.5 Red FM, Swag Fest is one of the largest Punjabi-pop music festivals in Delhi. An established IP of Red FM, the Swag Fest was launched in 2016 and has hosted Punjabi artists like Diljit Dosanjh, Parmish Verma, Guru Randhawa, Neha Bhasin, B Praak, Jassi Gill, Babbal Rai, Milind Gaba, Bohemia, Jas Manak and many others. The fifth edition of the festival brings you the most scintillating day-long musical extravaganza featuring performances by Rapper Naveen Kumar, DJ Tarun, Sid K, MC Square and Millind Gaba, with the sensational rapper and music producer, Yo Yo Honey Singh headlining the event. Besides an exciting musical evening, thefestalso offers an elaborate spread of cuisines and drinks, as well as a well-curated flea market."
Sur Jahan,Music,Kolkata,West Bengal,31 Jan 2025,02 Feb 2025,"Sur Jahan, the annual signature festival ofbanglanatak dot com, celebrates the unifying power of music in bringing peace. In its12th edition,Sur Jahan 2025 will be held across Kolkata (31 January to 02 February), Bannabagram (04 February), and Goa (07 to 08 February). The festival features internationally renowned bands Umbra Ensemble (Iceland), Folkcorn (Netherlands), and the Ale Moller Trio (Sweden), blending medieval, folk, and contemporary music with unique instruments."
Sunderban Mela,Arts and Crafts,Sunderbans,West Bengal,25 Oct 2023,27 Oct 2023,"The Sunderban Mela celebrates the diverse arts and crafts of the Sunderbans, a mangrove area at the confluence of the Ganges, Brahmaputra, and Meghna rivers in the Bay of Bengal. This festival highlights the unique cultural landscape of the region and is dedicated to showcasing the Intangible Cultural Heritage (ICH)-based crafts and performing arts of the Sunderbans. The festival features various folk art forms such as Bhatiyali, Bonbibir Pala, Jhumur, shola work, Chau dance and Baul songs. Bhatiyali, a mystic form of folk music sung by boatmen while sailing down the rivers, has 150 practicing artists in Jogeshganj Block in the Sunderbans. Bonbibir Pala, a mythology-based folk drama, is practised by 18 groups residing in Jameshpur, Bali, Rangabelia and Jameshgunj. Jhumur, introduced by groups of migrants from Chota Nagpur Plateau during the British rule, is currently practiced by 17 groups in different parts of the Sunderbans, especially Jameshpur and Dayapur."
Sree Ramanavami Global Music Festival,Music,Bengaluru,Karnataka,09 Apr 2024,13 Apr 2024,"With the onset of Rama Navami, a Hindu festival that celebrates the birth of Lord Rama, begins the prestigious,Sree Ramanavami Global Music Festivalin Bengaluru. A much-loved event in the Indian classical music circuit, this primarily Carnatic festival has hosted eminent musicians since 1939. Three Presidents and four Vice Presidents of India and all the Governors and Chief Ministers of Karnataka have inaugurated the celebrations."
South Side Story,Music,NESCO Grounds Goregaon Mumbai,Maharashtra,14 Dec 2024,,"South Side Story is a cultural extravaganza celebrating South Indian heritage in Mumbai and Delhi. Organised by Team Red FM, this event captures the essence of South India through live performances by renowned contemporary artists, traversing genres like rap, folk, rock, and pop. The festival connects South and North India through incredible music, crafts, and art forms, offering a rich tapestry of cultural experiences."
Serendipity Arts Festival,Multiarts,Panaji,Goa,15 Dec 2024,22 Dec 2024,"From its launch in 2016, the Serendipity Arts Festival in Goa has evolved into one of the largest annual interdisciplinary cultural extravaganzas in South Asia. A panel of 14 curators selects the events and experiences, which are presented over eight days in December across multiple venues in Panjim. Curated by an eminent panel of artists and experts, the Festival aims to initiate positive change in Indias creative ecosystem. Spanning the visual, performing, and culinary arts, the Festival addresses crucial issues such as arts education, cultural patronage, interdisciplinary discourse, and access to the arts."
Saz-E-Bahar,Music,Mumbai,Maharashtra,04 Apr 2025,05 Apr 2025,"The Saz-E-Bahar: Festival of Indian Instrumental Music, organised by theNational Centre for Performing Arts (NCPA), is back with its tenth edition. This multi-day event promises to showcase four talented instrumentalists who will be wielding a variety of instruments ranging from percussion-based ones such as drums and tabla to string instruments like the mandolin, sitar, sursingar, and mohanveena. Tabla artist Vijay Ghate, mandolin player U. Rajesh, sitar player Kushal Das and sursingar and mohanveena player Joydeep Mukherjee will be showcasing their musical prowess at the festival. To make the experience more immersive, Dr Suvarnalata Rao, Head of Programming (Indian Music) at the NCPA, will present a pre-event talk on specific instruments each day at 6 pm."
Santiniketan Mela,Music,Bolpur,West Bengal,18 Oct 2024,20 Oct 2024,"Santiniketan in Birbhum district, inscribed as a UNESCO World Heritage site in 2023, is a cultural treasure that embodies universalism and inclusive education through Visva-Bharati University, founded by Nobel laureate Rabindranath Tagore. This iconic place not only houses the prestigious university but also showcases a vibrant cultural heritage, including the soulful Baul songs, intricate Kantha embroidery, exquisite Shola craft and the visual storytelling tradition of Patachitra."
Sandscape,Music,Jaisalmer,Rajasthan,08 Feb 2020,10 Feb 2020,"Launched in 2017, Sandscape is a music festival that takes place across the city of Jaisalmer and the dunes surrounding the villages of Khuri and Barna. It features Indian and international electronic and folk music acts whose sets are supported by 3D visual mapping and body performances. Electronic music DJs and producers Ma Faiza and Mashter and Rajasthani folk singers Kutle Khan and Mame Khan are among the artists to have played Sandscape in previous years."
Sama’a: The Mystic Ecstasy,Music,Mumbai,Maharashtra,10 Feb 2023,12 Feb 2023,"Samaa: The Mystic Ecstasy, is a festival of Sufi music organised by theNational Centre for Performing Arts(NCPA). The festival embodies the values of Sufism and emphasises the use of music to deepen ones relationship with the Creator and attain spiritual transcendence through Samaa, the Sufi practice of listening to music, chanting, and whirling."
Sahaj Parav – The Root Music Festival,Music,Kolkata,West Bengal,18 Nov 2023,,"Sahaj Parav – The Root Music Festival celebrates traditional culture and customs by showcasing the vibrant artistry of the India. The festival unites diverse performing arts, from ethnic to folk groups, on a single stage to captivate, inspire and evolve. Beyond entertainment, Sahaj Parav envisions to preserve Indias rich heritage and foster cultural harmony."
Safarnama,Multiarts,Pune,Maharashtra,27 Jun 2025,29 Jun 2025,"Safarnama is a three-day residential festival dedicated to travellers, thoughtfully curated by a community ofexperienced travellers.The festival provides a platform for participants to engage with like-minded individuals through a carefully designed programme of workshops and interactive sessions, each aimed at fostering meaningful connections with nature, community and self."
Royal Enfield Journeying Across The Himalayas,Arts and Crafts,Delhi,Delhi NCR,05 Dec 2024,15 Dec 2024,"Royal Enfields Journeying Across the Himalayas is a groundbreaking multidisciplinary festival that celebrates the diverse cultural and creative heritage of the Himalayan region. Bringing together over 50 Himalayan communities, 100 partners, 150 experts, and 200 creative practitioners,the festivaloffers a vibrant platform for music, art, food, literature, textiles, and meaningful discussions."
RhythmXChange,Music,Bengaluru,Karnataka,25 Nov 2022,27 Nov 2022,"RhythmXChange is a festival that seeks to explore rhythm as a shared language. A collaboration between theIndian Music Experience Museum(IME), Bangalore, and Manchester Museum, UK, the project brought together four Indo-UK musicians with two mentees – one from India and one from the UK – to design and facilitate a percussion-based art project. Starting in the autumn of 2022, this six-month developmental project culminated in two international performances in 2022-23 to showcase the cross-culture artistic outcome of the project. The first was held at the IME in November 2022, while the second was held at the Manchester Museum in March 2023."
RED FM Sounds Of Punjab 2024,Music,New Delhi,India,23 Mar 2024,,"The fourth season of Sounds of Punjab featured the renowned singer Gurdas Maan, a legend in Punjabs music scene, paying homage to the essence of the region. The festival showcased a vibrant array of Punjabi cultural elements, including traditional food, lively Bhangra and Giddha performances, Gatka displays, and much more. Sounds of Punjab celebrated Punjabs rich heritage and traditions at Talkatora Stadium, New Delhi."
Rashtriya Sanskriti Mahotsav,Multiarts,Mumbai,Maharashtra,11 Feb 2023,19 Feb 2023,"The Rashtriya Sanskriti Mahotsav was conceptualised by the Ministry of Culture, Government of India, in 2015 to celebrate the spirit of tradition, culture, heritage and diversity. The festival aims to preserve, promote and popularise the heritage of Indian spirit and reconnect the new generation with our culture. It has been instrumental in presenting folk and tribal art, dance, music, cuisines and culture of one state in other states to achieve the cherished goal of Ek Bharat, Shreshtha Bharat."
Ranthambhore Music & Wildlife Festival,Music,Sawai Madhopur,Rajasthan,11 Nov 2022,12 Nov 2022,"Held annually at the Nahargarh Palace since 2017, the Ranthambhore Music & Wildlife Festival provides audiences an opportunity to discover and appreciate musical styles, genres and traditions, timeless folk art and the beautiful and majestic wildlife of India."
Rajasthan Kabir Yatra,Music,Multicity,Rajasthan,02 Oct 2024,07 Oct 2024,"This folk music festival, which travels across the rural regions of Rajasthan between 2 and 8 October every year, is a place for musicians, artists, scholars, students and seekers to immerse themselves in the worlds of Bhakti and Sufi poetry. Featuring over 30 performers, Rajasthan Kabir Yatra was inspired by spiritual traditions such as the jaagran/satsang, an all-night event where singers from different communities come together to sing and discuss the works of poet-saints such as Kabir, Mirabai and Bulleh Shah."
Ragasthan,Music,Jaisalmer,Rajasthan,23 Feb 2018,25 Feb 2018,"Ragasthan is a multi-genre music festival set amidst the sand dunes of the Thar Desert in Jaisalmer, Rajasthan. The performances take place across three stages: Birakha is for singer-songwriters and spoken word artists; Morio for rock, pop and folk music; and Ammara for electronic music."
Pune International Literary Festival,Literature,Pune,Maharashtra,14 Dec 2024,15 Dec 2024,"Pune International Literary Festival (PILF) is the first and only multi-lingual literary festival that is free for all in Pune. Author and filmmakerDr. Manjiri Prabhufounded the festival, which was held for the first time in 2013 and has since become one of the top eight literary festivals in India."
Poila Baithak,Music,Kolkata,West Bengal,22 Apr 2023,,"Celebrating the rich legacy of Bengali New Year through Rabindra Sangeet and baul (mystic minstrels from Bengal and Bangladesh) songs, the Poila Baithak festival in Kolkata brought together the best of both Bangladesh and West Bengal through music, food and the quintessential Bengaliadda(an informal gathering for conversation). Hosted by the citys most beloved voices like RJ Nilam and RJ Niel, the third and latest edition of the boutique Poila Baithak festival upheld the theme, Baul Beyond Borders and explored variations inbaulmusic with artists like Karthika Das Baul and folk bands such as Fakira and Joler Gaan. Organised by93.5 Red FM, theeventwas a grand celebration ushering in the month of Boishakhi in Bengal."
Pandit Durgalal Festival,Dance,Mumbai,Maharashtra,05 Feb 2023,,"Founded by theSamved Society for Performing Arts, the Pandit Durgalal Festival is held in memory of the doyen of the Jaipur gharana of Kathak. It was started by his discipleUma Dograas part of the Samved Society. Over three decades, this festival has seen luminaries from the field of Indian classical vocal, instrumental and dance grace its stage and pay tribute to the kathak legend. This is the 33rd edition of the festival. Some of the renowned artists who have performed in the Pandit Durgalal Festival include Pt Jasraj, Ustad Amjad Ali Khan, Pt Shiv Kumar Sharma, Pt Hariprasad Chaurasia, Smt Sitara Devi, Pt Birju Maharaj, Pt Kelucharan Mohapatra, Smt Sonal Mansingh and Shri Jagjit Singh."
Paddy Fields – India’s Premier Folk Fusion Music Festival,Music,Mumbai,Maharashtra,15 Oct 2022,16 Oct 2022,"Indias premier folk-fusion music festival, Paddy Fields packages and presents folk music from across the country to an audience weaned on Bollywood and international pop, rock and jazz music. Its a festival where, the organisers say, music lovers discover traditional music theyve never heard before and watch well-known musicians perform sets theyve never played before."
NH7 Weekender,Music,Pune,Maharashtra,14 Dec 2024,15 Dec 2024,"Bacardi NH7 Weekender, or NH7 as its popularly known, is arguably Indias largest and most-loved multi-genre indie music festival. Since 2017, it has also run an extremely popular stage for stand-up comedy. Staged in Pune from 2010 and in the state of Meghalaya since 2015 between October and December, NH7 occasionally travels to other cities such as Bengaluru, Delhi, Hyderabad and Kolkata. Independent music in genres such as electronic, hip-hop and rock makes up most of the line-up. Often, theres a bit of Bollywood thrown in. The line-ups are a mix of established and emerging Indian and international music stars."
Neon East Fest,Music,Mumbai,Maharashtra,12 Oct 2019,13 Oct 2019,"Conceptualised and curated by Third Culture Entertainment, Mumbai-based Neon East is a music festival that spotlights some of todays most relevant and emerging electronic artists from across India and the world. Little Dragon and Mura Masa headlined the inaugural edition of Neon East Fest in 2019, which also featured Andre Power, Mr. Carmack and Phum Viphurit."
NCPA International Jazz Festival,Music,Mumbai,Maharashtra,22 Nov 2024,24 Nov 2024,The National Centre for the Performing Arts launched the NCPA International Jazz Festival in 2017 to bring to audiences acclaimed jazz bands and soloists from across the country and the world in a format that combines experimental styles with familiar standards and new compositions with others by the masters.
NCPA Bandish: A Tribute to Legendary Composers,Music,Mumbai,Maharashtra,15 Jul 2022,17 Jul 2022,"Mumbais National Centre for the Performing Arts launched Bandish: A Tribute to Legendary Composers in 2010 to showcase iconic works by celebrated music composers through performances by some of the countrys finest artists. The festival is named after the Hindustani classical term bandish, the melodic and rhythmic composition that forms the base upon which the edifice of a performance is sculpted and realised.  In addition to Hindustani classical and semi-classical forms, Bandish has featured concerts of Carnatic classical music, Indian devotional music and ghazals as well as Hindi film songs."
Nabanna Folk Art and Craft Fair,Arts and Crafts,Shantiniketan,West Bengal,16 Mar 2024,26 Mar 2024,"Nabanna Folk Art and Craft Fair is a 10-day annual folk art and craft fair that is held during the spring celebrations – also known as Basanta Utsav – in Shantiniketan, West Bengal. A unique experience in many ways, the festival brings together demonstration of the craft in [the] making, direct interaction with artisans… [and] traditional, innovative and climate conscious initiatives."
Musicathon,Music,Bir,Himachal Pradesh,15 Nov 2024,16 Nov 2024,"Launched in 2019, Musicathon is a festival organised by artist managerGaurav Kumar Kushwahamultiple times a year, and showcases musical acts by emerging artists from various parts of the country. After a stunning festival at Bir, Himachal Pradesh this year, Musicathon is now back in Delhi with a stellar line-up including artists Akanksha Grover, Buland Himalay and Arjan Singh."
Mumbai Dance Season,Dance,Mumbai,Maharashtra,09 Jan 2025,02 Feb 2025,"TheNational Centre for Performing Arts(NCPA) started the Mumbai Dance Season in 2018 as a community initiative to foster camaraderie in the citys thriving dance community. As a month-long celebration of dance, the season features workshops, lectures, demonstrations and performances by classical dance experts, teachers, young choreographers and institutions. A wide range of venues across Mumbai will host both free and paid events throughout the season."
Mukta: The Voices of Women Today,Music,Mumbai,Maharashtra,05 Aug 2022,07 Aug 2022,"Launched in 2022 by the Mumbai-based National Centre for the Performing Arts to celebrate 75 years of Indias Independence, Mukta: The Voices of Women Today is a three-day Indian classical music festival comprising performances conceptualised, composed and led by female artists."
