festival_name,genre,city,state,start_date,end_date,description
Mudra Dance Festival,Dance,Mumbai,Maharashtra,03 Apr 2025,29 Apr 2025,"The Mudra Dance Festival is a thematic dance festival, organised every year by theNational Centre for the Performing Arts (NCPA)and pivots around socially significant themes such as motherhood, colours, bhakti poetry, animal movements etc. The festivals latest edition explored a unique theme Aparajita, meaning undefeated, that shed light on the lives of women who have persevered through challenges. Through its unique programming, the Mudra Dance Festival aims to celebrate the ability of human beings to find strength amidst lifes struggles and emerge undefeated. Highlights at this years Mudra Dance Festival included an Odissi performance by Guru Sutapa Talukdar and South Gurukul Society, Kathak performance by Guru Rajashree Shirke and Lasya, performances by Sonal Mansingh and the Centre for Indian Classical Dances Repertory Group, Sandhya Purecha and Bharata College of Fine Arts and Culture."
Maya Bazaar,Music,Bengaluru,Karnataka,28 Sep 2024,29 Sep 2024,"An initiative by the team at Road to Utopia – a queer feminist DEI consulting firm that is steering the world toward empathy and respect – Maya Bazaar is a first-of-its-kind series of inclusive marketplaces organised in various cities of India. Launched in 2021, as a platform for business owners, artists, and performers from the LGBTQIA+ community, Maya Bazaar began as a way to amplify the presence of those less seen and heard, and to uplift communities and bolster livelihoods."
Majuli Music Festival,Music,Majuli,Assam,21 Nov 2024,24 Nov 2024,"The Majuli Music Festival (MMF) is an annual not-for-profit music festival staged in the picturesque island of Majuli in Assam. It was launched in 2019 by theMajuli Music Festival Foundation, held again in 2021 and hosts over 30 artists from across India. On the bill previous year were singers Bishrut Saikia, Doctor Lincoln, Joi Barua, Lucky Ali, Nilotpal Bora, Salman Elahi and Trishna Gurung, the duo O Daapun, and the bands Avora Records, Jutimala and the Tai Folks, Madhouse Mongrels, Motherjane, Naalayak, The Midnight Taxi and The Sleeping Satellite."
Mahindra Roots Festival,Heritage,Mumbai,Maharashtra,24 Feb 2023,26 Feb 2023,"The Mahindra Roots Festival (MRF) aims to explore distinctive and forgotten art forms that are integral to Indias cultural heritage. The festival features theatre performances, immersive storytelling, folk music, classical music and poetry in multiple languages, including Hindi, Punjabi, English, and Kannada, among others, as well as tribal music forms, contemporary Sufi, Abhangas, Bengals Baul music tradition etc.MRFshowcases art through various formats such as larger-than-life installations, spectacular décor and much more, reintroducing audiences to their grand cultural heritage. Furthermore, artists from various genres, languages, and cultures enthral audiences with performances that are an aural and visual treat."
Mahindra Percussion Festival,Music,Bengaluru,Karnataka,01 Mar 2025,02 Mar 2025,"The Mahindra Percussion Festival is a vibrant celebration of rhythm where attendees can rise to the beat. It stands as a unique amalgamation of music, food, festivity and culture, with percussion and expression at its core. Percussion instruments and their rhythmic cadences have played a central role in social and cultural activities since ancient times. Drums, for instance, hold the distinction of being the oldest musical percussion instrument known to mankind. The Mahindra Percussion festival aims to establish itself as a groundbreaking platform, transcending various music genres, all propelled by the beats of percussion."
Mahindra Open Drive,Music,Mumbai,Maharashtra,26 Feb 2022,,"A travelling, outdoor festival with music at its heart, infused with culture and adventure, Mahindra Open Drive takes place between December and February. The inaugural edition of the day-long event was held in February 2022 at Camp Max, which overlooks Lake Kalote in the outskirts of the Mumbai-Pune highway. It featured performances by Indian independent acts such as Benny Dayal, Kamakshi Khanna, Peter Cat Recording Co., Raghav Meattle, Voctronica and When Chai Met Toast. Attendees could go kayaking in the lake and try their hand at activities such as pottery."
Mahindra Kabira Festival,Music,Varanasi,Uttar Pradesh,13 Dec 2024,15 Dec 2024,"Every November, Varanasi, the birthplace of the mystic-saint poet Kabir, comes alive with an annual musical celebration of his inclusive philosophy and the lyrical aspect of his teachings. Along with performances by leading exponents of the Benares gharana of Hindustani classical music, the audience is treated to folk traditions, Sufi music, ghazals and the dadra, thumri and khayal gayaki styles. Sessions on art and literature inspired by Kabir; specially curated walks with local experts; and stalls showcasing regional cuisines are among the non-musical highlights of the Mahindra Kabira Festival experience."
Mahindra Independence Rock,Music,Mumbai,Maharashtra,16 Nov 2024,17 Nov 2024,"Pioneering music festival Independence Rock returned in 2022 after a hiatus of nine years, with founder Farhad Wadia teaming up withHyperlink Brand Solutionsas co-organiser and the Mahindra Group as title partner. I-Rock, launched in 1986, was both the countrys longest-running and most popular rock festival. Attending the event was a rite of passage for the countrys rock and metal fans who thronged its venues, alfresco auditorium Rang Bhavan and subsequently the Chitrakoot Grounds, for the annual headbanging ritual."
Mahindra Blues Festival,Music,Mumbai,Maharashtra,08 Feb 2025,09 Feb 2025,"Launched in 2011 with the aim of forming the biggest blues community in Asia, this annual two-daymusic festival byMahindra & Mahindra features some of the genres biggest and best acts. Among the legends and stars to have headlined the festival, which takes place at Mumbais Mehboob Studios, are its official ambassador Buddy Guy, John Mayall, Charlie Musselwhite, Walter Trout, Jimmie Vaughan, Coco Montoya, Keb Mo, John Lee Hooker Jr., Doyle Bramhall II, Beth Hart, Kenny Wayne Shepherd, Robert Randolph, Jonny Lang, Joss Stone and Quinn Sullivan.In 2016, the stages were renamed the Polka Dot Parlour, after Guys signature polka-dot shirt, and the Soul Strat Saloon after homegrown blues-rock heroes Soulmate and Blackstratblues, who have played the event multiple times. Since 2015, the festival has conducted the nationwide Mahindra Blues Band Hunt through which the winning group gets to perform on the garden stage of the festival on both days. The previous winners are Aayushi Karnik,  Blu, Arinjoy Trio, Blue Temptation and Quiet Storm. The festival was last held in 2020. However, the one-day Mahindra Blues Special, featuring Soulmate and fellow Indian blues musicians, was staged in March 2022."
Magnetic Fields,Music,Jhunjhunu,Rajasthan,06 Dec 2024,08 Dec 2024,"Magnetic Fields is a three-day music festival that takes place at 17th-century palace Alsisar Mahal in Shekhawati, Rajasthan. The annual festival, which was launched in 2013, showcases the countrys best and most forward-thinking music alongside some of the worlds finest underground stars. Among the acts to have played on its many stages include path-breakers such as Arjun Vagale, Ben UFO, Charanjit Singh, Daphni, DJ Koze, Four Tet, Hunee, HVOB, Khruangbin, Maribou State, Peter Cat Recording Co., Ratatat and Shanti Celeste. Each year also features performances by local Rajasthani folk musicians."
Madras Jazz Festival,Music,Chennai,Tamil Nadu,15 Dec 2022,16 Dec 2022,"The experience of listening to Jazz in a city thats grown up on a diet of Carnatic classical is unparalleled. Madras Jazz Festival, an annual festival hinged on an old city name, aims to fuel the world of jazz in Chennai (formerly Madras) by bringing together artists from Europe and India."
Maati Putr Ceramic Festival,Arts and Crafts,MUMBAI,Maharashtra,18 Oct 2024,30 Nov 2024,"The Maati Putr Ceramic Festival, hosted byKathiwada City House, is a celebration of the deep bond between clay and nature, honouring the art of ceramics and studio pottery. Launched in 2024, this inaugural edition pays tribute to the timeless craft, offering a contemporary platform for artisans to showcase their work. The name Maati Putr, meaning Child of the Earth, reflects the connection between ceramists and the raw elements of the earth, transforming clay into evocative pieces of art."
Lollapalooza India,Music,Mumbai,Maharashtra,08 Mar 2025,09 Mar 2025,"Launched in 1991, Lollapalooza is a multi-genre music festival. A pioneering force since its inception,Lollapaloozawas one of the first festivals to bring together performers from a wide range of genres. The festival was also one of the first to introduce the multi-stage concept – one that has grown to be a popular feature for music festivals across the world. Over the last three decades, the festival has been held across seven different locations across the world, including France, Germany, Sweden, Argentina, and Brazil."
Lodhi Festival,Multiarts,New Delhi,Delhi NCR,18 Mar 2023,19 Mar 2023,"The first edition of the Lodhi Festival was held at the Lodhi Art District in New Delhi between 18 and 19 March, 2023. Organised bySt+art India Foundationin collaboration with theKiran Nadar Museum of Art (KNMA)andG20, the festival hosted an incredible line-up of performances from all over India. The festival included a weekend comprising music, dance, theatre, visual arts and more. There were also vibrant and exciting workshops at the festival, offering fun and creativity for all ages."
LLDC Winter Festival,Multiarts,Bhuj Kutch,Gujarat,19 Jan 2024,24 Jan 2024,"The Living and Learning Design Centre (LLDC Craft Museum), Ajarakhpur, Bhuj-Kutch, continues its tradition of cultural celebration with the timeless LLDC Winter Festival. Collaborating with Madhya Pradesh, this festival promises a continued exploration of diverse art and craft traditions, transcending temporal and geographical boundaries."
LLDC Festival of Music,Music,Kutch Gujarat,Gujarat,27 Oct 2023,29 Oct 2023,"The Living and Learning Design Centre, also known as LLDC, is a museum and cultural centre based in Ajrakhpur, Kutch. In line with its vision of preserving and sustaining the crafts of the district, the LLDC organises a music festival each year. It aims to promote both roots and contemporary music from across the country on the same stage. LLDC Festival of Music is the first-of-its-kind festival in Kutch to promote, encourage and provide a platform to emerging young artists from the field of music. Initiated in 2022 by The Shrujan Trust, Kutch, this music festival has become an annual tradition, taking place each October around the occasion of Sharad Poornima. Over the course of three days, the festival celebrates a diverse array of musical genres and traditions."
LiveBox Festival,Music,Mumbai,Maharashtra,24 Sep 2022,,
Lemonade Goa,Music,Goa,Goa,31 Dec 2022,,Lemonade Goa is an independent music festival organised bySkillbox.
Langa Music Festival,Music,Barnawa Jageer,Rajasthan,12 Nov 2022,13 Nov 2022,"This weekend-long festival, at Barnawa Jageer village in the Barmer district, showcases the history and traditions of the Langa community of folk musicians from west Rajasthan. It is part of a collaborative initiative of the Department of Tourism, Government of Rajasthan and UNESCO to strengthen the Intangible Cultural Heritage of the region."
Lalaland Festival,Music,Goa,Goa,29 Jun 2024,30 Jun 2024,"LaLaLand Festival saw its ﬁrst edition in Goa in March 2018. From approximately 800 visitors it has now grown to a festival with over 3000 visitors. After multiple additions in India and Netherlands, were returning to Goa with our 5th edition this December where dreams will become a reality."
Ladakh International Music Festival,Music,Leh,Ladakh,30 Apr 2022,02 May 2022,"Ladakh, also known as the Land of High Passes, hosted the inaugural edition of the Ladakh International Music Festival in 2022. The three-day event featured performances by some of the countrys best-known rock acts, a band competition for local musicians, and a special tribute to the brave hearts of the Indian Army at one of the worlds highest war memorials, Rezang La, located at an elevation of 18,000 feet."
Kholey Dai Festival,Music,Parengtar,West Bengal,13 Dec 2024,15 Dec 2024,"The Kholey Dai Festival, launched in 2021, is an annual rice harvest and folk music festival in the village of Parengtar inKampilong. It aims to revive and reestablish community activities around rice grain harvesting, known as dai in Nepali."
Kasauli Rhythm & Blues Music Festival,Music,Kasauli,Himachal Pradesh,19 Apr 2019,20 Apr 2019,"Genesis Foundation conceptualised the Kasauli Rhythm & Blues Music Festival in 2012 with the belief that music is a positive and participatory force in creating change in society. Held annually amidst the lush landscape of Kasauli, Himachal, the festival raises funds for the treatment of critically ill and underprivileged children suffering from heart disorders. Singers such as Usha Uthup, Leslie Lewis, Rabbi Shergill, Ankur Tewari and Jonita Gandhi and bands like Parikrama, Thaikkudam Bridge, The Local Train, Parvaaz and When Chai Met Toast are among the acts who have supported the cause and performed at the Kasauli Rhythm & Blues Music Festival over its eight editions. The festival was last held in 2019."
Kantha Mela,Music,Agortor Nanoor,West Bengal,18 Oct 2024,20 Oct 2024,"Agartor village, located in Nanoor block of Birbhum district, is a vibrant cultural hub, renowned for its intricate Kantha embroidery, which sustains a rich tradition of artistic craftsmanship. In Agartor, there is a Kantha museum supported by Coal India Limited, which serves as a dedicated space to practice, promote, and safeguard the timeless tradition of Kantha embroidery. Apart from its cultural treasures, the village is steeped in history, housing the Chandidas temple and the residence of the revered 14th-century poet Chandidas, known for his Sri Krishna Kirtan, a poetic tribute to the divine love of Radha and Krishna. This blend of artistic tradition, historical significance, and natural beauty makes Agartor a unique destination where culture and history seamlessly converge."
Jodhpur RIFF,Music,Jodhpur,Rajasthan,16 Oct 2024,20 Oct 2024,"The Jodhpur RIFF (Rajasthan International Folk Festival) is Indias premiere international roots music festival of folk, indigenous, jazz, reggae, classical and world music. It takes place every October around Sharad Poornima, the night of the brightest full moon in north India, in the intimate setting of the spectacular fifteenth-century Mehrangarh Fort."
Jharkhand and Odisha Folk Festival,Folk Arts,Goa,Goa,09 May 2025,11 May 2025,"The vibrant cultural heritage of Jharkhand and Odisha takes centre stage with the launch the Jharkhand and Odisha Folk Festival, an inaugural celebration curatedby Contact Basein association with Axis Bank Foundation and the International Centre Goa (Laran). Debuting from 09 to 11 May 2025, the festival honours the living traditions of Jharkhand and Odisha, spotlighting a dynamic blend of Chhau dance, tribal arts, and rural craftsmanship."
Jazz Weekender,Music,New Delhi,Delhi NCR,28 Sep 2024,29 Sep 2024,"The inaugural edition of the Jazz Weekender was organised and conceptualised in 2022 byboxout.fm, Wild City, Gatecrash, Art Unites & Jazz In India, to celebrate the occasion of International Jazz Day. It was a three-day festival showcasing some of the genres most exciting Indian and international artists, like drummer Gino Banks, guitarist Rhythm Shaw, singer Tribemama Marykali, the bands Four + 1, Pakshee, The Jass Bstards, The Revisit Project and many others."
Jazz India Circuit International Festival,Music,Delhi,Haryana,19 Mar 2023,,"The Jazz India Circuit International Festival is a one-stop destination to hear the newest and most diverse acts in contemporary jazz. The festival, which is staged annually in Delhi as well as in Goa, aims to push the boundaries of what typically constitutes the sound of jazz by curating experimental, up-tempo and funky styles of the form."
Jashn-e-Talat by Sahar Zaman,Music,Delhi,Delhi NCR,04 Feb 2020,,"A multi-city, multi-disciplinary festival in memory of legendary Hindi film playback singer and actor Talat Mahmood, Jashn-e-Talat by Sahar Zaman was launched in 2017 with an aim to introduce the much-loved vocalists music and movies to todays youth and keep his legacy alive."
Jashn-e-Rekhta,Multiarts,Delhi,Delhi NCR,13 Dec 2024,15 Dec 2024,"The multiarts festival, Jashn-e-Rekhta,  celebrates the Urdu language and Hindustani culture through ghazals, Sufi music, qawwali, dastaangoi, panel discussions, mushaira, poetry recitations and more."
Interface Arts Festival,Dance,Kolkata,India,10 Dec 2024,12 Dec 2024,"The International Festival of Contemporary Expressions (INTERFACE) is a unique international arts festival in Eastern India, dedicated to showcasing contemporary dance experiments from around the globe. Established in 2002 bySapphire Creations Dance Companyto commemorate its 10th anniversary, the festival celebrates the transformative power of the arts, exploring movement and the intersection of creative forms. Over the years, INTERFACE has featured artists from countries including the USA, Malaysia, and India."
Indiegaga,Music,Kozhikode,Kerala,21 Jan 2023,,"Indiegaga is a travelling multi-genre independent music festival. Kerala-based artist management and event company Wonderwall Media launched the festival in 2019 in Kochi. After a pandemic-caused hiatus, Indiegaga returned in May 2022."
India International Music Week (IIMW),Music,Goa,Goa,04 Feb 2025,06 Feb 2025,"India International Music Week (IIMW) is a pioneering initiative aimed at reshaping how the world engages with the Indian music ecosystem by fostering trade, cultural exchange, and collaboration.Designed toconnect Indian and International music markets, IIMW aspires to position India as a central hub for music innovation, exchange, and business opportunities on the global stage."
Idli Soda Festival,Music,Chennai,Tamil Nadu,18 Feb 2023,19 Feb 2023,"The Idli Soda Festival is the first Fusion Music Festival in Chennai, featuring eight live bands from across the country. The bands that will be performing during the two-day festival include Thaikkudam Bridge, Indian Ocean and Swarathma. Tamil Musician and Playback Singer Pradeep Kumar would also be performing at the festival. The Idli Soda Festival also host seven heavy-duty music workshops on vocal, instruments and music technology. The Idli Soda Festival will also accommodate food and merchandise stalls for the audiences gastronomic delight."
Hornbill Festival,Multiarts,Kohima,Nagaland,01 Dec 2024,10 Dec 2024,"Hornbill Festival is a ten day event that seeks to showcase Nagalands rich cultural heritage and traditions in all their glory. Established in 2000, the festival has since come to be popularly known as the festival of festivals. A unique event, it offers a peek into the cultural diversity of not only the Naga people, but all the north-eastern states of India."
Himalayan Flow Gathering 2.0,Arts and Crafts,Bir,India,29 Mar 2024,31 Mar 2024,"Himachals most awaited art and retreat festival is back with its second season from 29th to 31st March in Bir, Himachal Pradesh. The Himalayan Flow Gathering is a journey of self-discovery and personal growth. It is a three-day celebration of creativity, connection, and conscious living with a diverse range of workshops and live music performances by talented artists against the breath-taking views of the Himalayas."
Goa Sunsplash,Music,Goa,Goa,12 Jan 2025,13 Jan 2025,"Started in 2016, Goa Sunsplash is Indias largest celebration of reggae music and culture. The annual festival has three music stages, yoga and dance workshops, a flea market, food stalls and panel discussions."
Goa Pride Festival,Multiarts,Anjuna,Goa,07 Apr 2023,09 Apr 2023,"The Goa Pride Festival, also known as #Pyaarkatyohar, returned for its second edition in 2023. The festival was launched in 2022 byPranay Priyanka Bhowmickto create a safe space for the queer community in India. Thefestivalalso provides a platform for activists and community leaders to engage in meaningful discussions about LGBTQ+ rights and issues in India. This years festival featured a range of fun activities such as fire shows, cine-e-satrangi, partner games, Satrangi bazaar, and a Gender Bender fashion show. Attendees experienced a string of events such as Latin Mix Dance Party, DJ nights, and performances by some of the best artists in the queer community, including Goa-based drag artist Gautam Bandodkar. Thefestivalis a time for people to celebrate love in all its forms and embrace their identities."
Goa Open Arts Festival,Visual Arts,Panjim,Goa,23 Feb 2024,28 Feb 2024,"The Goa Open Arts Festival, launched in 2020, is back for its second edition at Panjims historic Maquinez Palace (Old GMC). The festival showcases local talents spanning visual arts, music, spoken word, performance, and films. Featuring an expanded venue and programme with curated live performances by guest experts,the festival targets engagement from local and statewide audiences."
Global ISAI Festival,Music,Chennai,Tamil Nadu,21 Feb 2020,23 Feb 2020,"Launched in 2012 in Chennai, the Global ISAI Festival was inspired by music festivals of Europe hosted by smaller villages. Described as the global music festival with a local heart, it showcases and celebrates all genres of western music. Pop, rock, blues, jazz, funk, hip-hop and even fusion are on offer. Spains Els Catarres, Australias Grace Barbé , Turkeys Light in Babylon and the UKs Susheela Raman are among the international stars to have performed."
Global Indie Festival,Music,Mumbai,Maharashtra,04 Nov 2023,05 Nov 2023,
GIFLIF Indiestaan Music Festival,Music,Huda Gymkhana Ground Gurugram,Delhi NCR,30 Nov 2024,01 Dec 2024,"The GIFLIF Indiestaan Music Festival, started in 2015, is a multi-city youth festival held in Gurgaon, Bhopal and Raipur. Organised byWhite Walls Media, the festival accommodates talks, film screenings, music concerts, plays, poetry recitals, storytelling sessions and book discussions among  several other events. Writers Devdutt Pattanaik, Gulzar, Javed Akhtar and Ruskin Bond and actors Rajat Kapoor, Saurabh Shukla, Taapsee Pannu and Vinay Pathak are among those who have been part of the festival over the years."
gFest,Arts and Crafts,Kochi,Kerala,16 Feb 2024,02 Jun 2024,"G-Fest is a celebration of artists and the art they have created under the genDeralities fellowships by the reFrame Institute of Art and Expression between the years 2020 and 2022. Spanning across media, form and aesthetic language, the artworks displayed at theorganisationreflect and reveal, disrupt, debate and contemplate the complex lived realities of women, transgender and queer folk in India today. The programmes at thefestivalincluded films, performances, podcasts, illustrated tales, digital performances, mixed media works, installations and music videos."
Gaia Festival,Music,Raison,Himachal Pradesh,28 Sep 2024,29 Sep 2024,"The Gaia Festival is a multi-disciplinary showcase of music, adventure, art and wellness activities that will take place in the lap of nature, against the breathtaking backdrop of the Himalayas, near the mystical River Beas in Raison (just 40 minutes before Manali and 5 hours by road from Chandigarh)."
Freedom Festival,Music,Bengaluru,Karnataka,26 Aug 2022,28 Aug 2022,"To commemorate 75 years of Indias Independence, the Indian Music Experience Museum will stage the weekend-long Freedom Festival featuring performances by stalwarts of Indian Karnatic, Hindustani and folk music. A total of 13 concerts will be presented, including those by mridangam player Umayalpuram Sivaraman, vocalists Sandeep Narayan and Sudha Ragunathan, and a group of Rajasthani folk musicians led by Kasam Khan Langa. The shows will be held at the MLR Convention Centre on 26 and 27 August and at the Indian Music Experience Museum on 28 August."
Firefly Festival,Music,Kamshet Pune,Maharashtra,01 Jun 2024,,"The Firefly Festival, hosted in Purrom, offers attendees an enchanting evening of music and nature during its third edition in June. Participants can enjoy soulful acoustic performances on an outdoor platform, surrounded by the magical glow of fireflies and the serene beauty of the forest. This event serves as a holistic getaway, catering to the enhancement of physical, nutritional, emotional, intellectual, environmental, and spiritual well-being."
Fest5 International Film Festival,Film,Kolkata,West Bengal,01 Feb 2024,04 Feb 2024,"Fest5 International Film Festival is a dynamic platform that unites filmmakers, artists and film enthusiasts to exchange ideas, share creativity and revel in the enchantment of the cinema. Thefestivalaims to showcase a diverse range of films, spanning various genres, languages, and cultures, fostering cultural exchange and promoting cross-cultural understanding. Set at the prestigious National Library in Kolkata, Fest5 International Film Festival embodies a vibrant celebration of cinematic excellence and artistic expression.Check out more film festivalshere."
